{
  "schemaVersion": 1,
  "variables": {
    "all": {
      "home": "{home}",
      "temp": "{temp}"
    },
    "windows": {
      "local": "{local}",
      "roaming": "{roaming}"
    }
  },
  "riskModel": {
    "default": "caution",
    "levels": {
      "keep": {
        "score": 10,
        "deleteAllowed": false
      },
      "caution": {
        "score": 50,
        "deleteAllowed": false
      },
      "cleanable": {
        "score": 80,
        "deleteAllowed": true
      }
    },
    "factors": {
      "userConfig": -40,
      "credentialPossible": -40,
      "toolchainExecutable": -25,
      "cacheRebuildable": 35,
      "temporary": 45,
      "packageMirror": 20,
      "largeMutableStore": 15
    }
  },
  "semanticGroups": {
    "developerEnvironment": ["runtime", "toolchain", "packageManager", "buildTool", "ide"],
    "cleanup": ["cache", "temp"],
    "sensitiveConfig": ["config", "aiTool", "container"],
    "mobile": ["mobile"]
  },
  "rules": [
    {
      "id": "codex_home",
      "nameKey": "env.codexHome",
      "category": "aiTool",
      "semantics": ["agentConfig", "userConfig", "credentialPossible"],
      "riskFactors": ["userConfig", "credentialPossible"],
      "pathByPlatform": {"all": "{home}/.codex"},
      "dependsOn": []
    },
    {
      "id": "codex_skills",
      "nameKey": "env.codexSkills",
      "category": "config",
      "semantics": ["agentSkill", "userConfig"],
      "riskFactors": ["userConfig"],
      "pathByPlatform": {"all": "{home}/.codex/skills"},
      "dependsOn": ["codex_home"]
    },
    {
      "id": "codex_cache",
      "nameKey": "env.codexCache",
      "category": "runtime",
      "semantics": ["runtimeCache", "rebuildable"],
      "riskFactors": ["cacheRebuildable"],
      "pathByPlatform": {"all": "{home}/.cache/codex-runtimes"},
      "dependsOn": ["codex_home"]
    },
    {
      "id": "general_cache",
      "nameKey": "env.generalCache",
      "category": "cache",
      "semantics": ["cacheRoot", "mixedOwnership"],
      "riskFactors": ["largeMutableStore"],
      "pathByPlatform": {"all": "{home}/.cache"},
      "dependsOn": []
    },
    {
      "id": "cargo_home",
      "nameKey": "env.cargoHome",
      "category": "toolchain",
      "semantics": ["rust", "packageHome", "userConfig"],
      "riskFactors": ["userConfig", "toolchainExecutable"],
      "pathByPlatform": {"all": "{home}/.cargo"},
      "dependsOn": []
    },
    {
      "id": "cargo_bin",
      "nameKey": "env.cargoBin",
      "category": "toolchain",
      "semantics": ["rust", "executablePath"],
      "riskFactors": ["toolchainExecutable"],
      "pathByPlatform": {"all": "{home}/.cargo/bin"},
      "dependsOn": ["cargo_home"]
    },
    {
      "id": "rustup_home",
      "nameKey": "env.rustupHome",
      "category": "toolchain",
      "semantics": ["rust", "toolchainManager"],
      "riskFactors": ["toolchainExecutable", "largeMutableStore"],
      "pathByPlatform": {"all": "{home}/.rustup"},
      "dependsOn": ["cargo_home"]
    },
    {
      "id": "rust_toolchains",
      "nameKey": "env.rustToolchains",
      "category": "toolchain",
      "semantics": ["rust", "toolchainInstall"],
      "riskFactors": ["toolchainExecutable", "largeMutableStore"],
      "pathByPlatform": {"all": "{home}/.rustup/toolchains"},
      "dependsOn": ["rustup_home"]
    },
    {
      "id": "go_path",
      "nameKey": "env.goPath",
      "category": "runtime",
      "semantics": ["go", "workspace"],
      "riskFactors": ["userConfig"],
      "pathByPlatform": {"all": "{home}/go"},
      "dependsOn": []
    },
    {
      "id": "go_cache",
      "nameKey": "env.goCache",
      "category": "cache",
      "semantics": ["go", "buildCache", "rebuildable"],
      "riskFactors": ["cacheRebuildable"],
      "pathByPlatform": {"all": "{home}/.cache/go-build"},
      "dependsOn": ["go_path"]
    },
    {
      "id": "maven_home",
      "nameKey": "env.mavenHome",
      "category": "packageManager",
      "semantics": ["jvm", "packageMirror"],
      "riskFactors": ["packageMirror", "largeMutableStore"],
      "pathByPlatform": {"all": "{home}/.m2"},
      "dependsOn": []
    },
    {
      "id": "gradle_home",
      "nameKey": "env.gradleHome",
      "category": "buildTool",
      "semantics": ["jvm", "buildTool", "cacheRoot"],
      "riskFactors": ["packageMirror", "largeMutableStore"],
      "pathByPlatform": {"all": "{home}/.gradle"},
      "dependsOn": []
    },
    {
      "id": "android_gradle_cache",
      "nameKey": "env.androidGradle",
      "category": "cache",
      "semantics": ["android", "gradle", "cacheRebuildable"],
      "riskFactors": ["cacheRebuildable"],
      "pathByPlatform": {"all": "{home}/.gradle/caches"},
      "dependsOn": ["gradle_home"]
    },
    {
      "id": "deno_home",
      "nameKey": "env.denoHome",
      "category": "runtime",
      "semantics": ["javascript", "runtime", "packageCache"],
      "riskFactors": ["packageMirror"],
      "pathByPlatform": {"all": "{home}/.deno"},
      "dependsOn": []
    },
    {
      "id": "bun_home",
      "nameKey": "env.bunHome",
      "category": "runtime",
      "semantics": ["javascript", "runtime", "packageCache"],
      "riskFactors": ["packageMirror"],
      "pathByPlatform": {"all": "{home}/.bun"},
      "dependsOn": []
    },
    {
      "id": "pnpm_store",
      "nameKey": "env.pnpmHome",
      "category": "packageManager",
      "semantics": ["javascript", "packageStore", "rebuildable"],
      "riskFactors": ["packageMirror", "cacheRebuildable"],
      "pathByPlatform": {"all": "{home}/.pnpm-store", "windows": "{local}/pnpm"},
      "dependsOn": []
    },
    {
      "id": "npm_cache",
      "nameKey": "env.npmCache",
      "category": "cache",
      "semantics": ["javascript", "packageCache", "rebuildable"],
      "riskFactors": ["cacheRebuildable"],
      "pathByPlatform": {"windows": "{local}/npm-cache", "linux": "{home}/.npm", "macos": "{home}/.npm"},
      "dependsOn": []
    },
    {
      "id": "npm_global",
      "nameKey": "env.npmGlobal",
      "category": "packageManager",
      "semantics": ["javascript", "globalExecutables"],
      "riskFactors": ["toolchainExecutable"],
      "pathByPlatform": {"windows": "{roaming}/npm"},
      "dependsOn": ["npm_cache"]
    },
    {
      "id": "yarn_cache",
      "nameKey": "env.yarnCache",
      "category": "cache",
      "semantics": ["javascript", "packageCache", "rebuildable"],
      "riskFactors": ["cacheRebuildable"],
      "pathByPlatform": {"all": "{home}/.yarn/berry/cache", "windows": "{local}/Yarn/Cache"},
      "dependsOn": []
    },
    {
      "id": "pip_cache",
      "nameKey": "env.pipCache",
      "category": "cache",
      "semantics": ["python", "packageCache", "rebuildable"],
      "riskFactors": ["cacheRebuildable"],
      "pathByPlatform": {"windows": "{local}/pip", "linux": "{home}/.cache/pip", "macos": "{home}/.cache/pip"},
      "dependsOn": []
    },
    {
      "id": "python_programs",
      "nameKey": "env.pythonPrograms",
      "category": "runtime",
      "semantics": ["python", "runtimeInstall"],
      "riskFactors": ["toolchainExecutable"],
      "pathByPlatform": {"windows": "{local}/Programs/Python"},
      "dependsOn": ["pip_cache"]
    },
    {
      "id": "poetry_cache",
      "nameKey": "env.poetryCache",
      "category": "cache",
      "semantics": ["python", "packageCache", "rebuildable"],
      "riskFactors": ["cacheRebuildable"],
      "pathByPlatform": {"all": "{home}/.cache/pypoetry"},
      "dependsOn": ["pip_cache"]
    },
    {
      "id": "uv_cache",
      "nameKey": "env.uvCache",
      "category": "cache",
      "semantics": ["python", "packageCache", "rebuildable"],
      "riskFactors": ["cacheRebuildable"],
      "pathByPlatform": {"all": "{home}/.cache/uv"},
      "dependsOn": ["pip_cache"]
    },
    {
      "id": "conda_home",
      "nameKey": "env.condaHome",
      "category": "runtime",
      "semantics": ["python", "environmentManager"],
      "riskFactors": ["toolchainExecutable", "largeMutableStore"],
      "pathByPlatform": {"all": "{home}/.conda"},
      "dependsOn": []
    },
    {
      "id": "docker_home",
      "nameKey": "env.dockerHome",
      "category": "container",
      "semantics": ["container", "userConfig", "credentialPossible"],
      "riskFactors": ["userConfig", "credentialPossible"],
      "pathByPlatform": {"all": "{home}/.docker", "windows": "{local}/Docker"},
      "dependsOn": []
    },
    {
      "id": "vscode_home",
      "nameKey": "env.vscodeHome",
      "category": "ide",
      "semantics": ["ide", "extensions", "userConfig"],
      "riskFactors": ["userConfig", "largeMutableStore"],
      "pathByPlatform": {"all": "{home}/.vscode", "windows": "{roaming}/Code"},
      "dependsOn": []
    },
    {
      "id": "jetbrains_cache",
      "nameKey": "env.jetbrainsCache",
      "category": "ide",
      "semantics": ["ide", "cache", "index"],
      "riskFactors": ["largeMutableStore"],
      "pathByPlatform": {"windows": "{local}/JetBrains"},
      "dependsOn": []
    },
    {
      "id": "android_home",
      "nameKey": "env.androidHome",
      "category": "mobile",
      "semantics": ["android", "userConfig"],
      "riskFactors": ["userConfig"],
      "pathByPlatform": {"all": "{home}/.android"},
      "dependsOn": []
    },
    {
      "id": "android_sdk",
      "nameKey": "env.androidSdk",
      "category": "mobile",
      "semantics": ["android", "sdk", "toolchainInstall"],
      "riskFactors": ["toolchainExecutable", "largeMutableStore"],
      "pathByPlatform": {"windows": "{local}/Android/Sdk"},
      "dependsOn": ["android_home"]
    },
    {
      "id": "flutter_home",
      "nameKey": "env.flutterHome",
      "category": "mobile",
      "semantics": ["flutter", "userConfig"],
      "riskFactors": ["userConfig"],
      "pathByPlatform": {"all": "{home}/.flutter"},
      "dependsOn": []
    },
    {
      "id": "ai_openai_local",
      "nameKey": "env.openaiLocal",